{
  "$ref": "#/definitions/authors",
  "definitions": {
    "authors": {
      "type": "object",
      "properties": {
        "id": {
          "type": "string"
        },
        "name": {
          "type": "string"
        },
        "bio": {
          "type": "string"
        },
        "role": {
          "type": "string"
        },
        "twitter": {
          "type": "string",
          "format": "uri"
        },
        "linkedin": {
          "type": "string",
          "format": "uri"
        },
        "instagram": {
          "type": "string",
          "format": "uri"
        },
        "image": {
          "type": "string"
        },
        "$schema": {
          "type": "string"
        }
      },
      "required": [
        "id",
        "name",
        "image"
      ],
      "additionalProperties": false
    }
  },
  "$schema": "http://json-schema.org/draft-07/schema#"
}