[
  {
    "id": "michael-sables",
    "name": "Michael Sables",
    "role": "Full Stack Developer",
    "bio": "Michael Sables is a software engineer and writer. He is passionate about technology and its impact on society. He enjoys sharing his knowledge with others and helping them learn new things.",
    "image": "./michael-sables.jpg"
  }
]
